"Reino","Filo","Classe","Ordem","Familia","Genero","Especie","Subespecie","Nome_Cientifico_Anterior","Autor","Nome_Comum","Grupo","Mes_Ano_Avaliacao","Categoria","Possivemente_Extinta","Criterio","Justificativa","Endemica_Brasil","Consta_em_Lista_Nacional_Oficial","Estado","Regiao","Bioma","Bacia_Hidrografica","Unidade_de_Conservacao_Federal","Unidade_de_Conservacao_Estadual","RPPN","Migratoria","Tendencia_Populacional","Ameaca","Uso","Acao_Conservacao","Plano_de_Acao","Listas_e_Convencoes","Altitude_min_max_","Barimetria_min_max_"
"Animalia","Chordata","Reptilia","Squamata","Dipsadidae","Apostolepis","Apostolepis quirogai","","Apostolepis quirogai","Giraudo & Scrocchi, 1998","","Répteis","11/2019","Em Perigo","","B1ab(iii)","Apostolepis quirogai ocorre Brasil e no nordeste da Argentina. A espécie é conhecida de apenas três indivíduos no Brasil, oriundos de três localidades no noroeste do Rio Grande do Sul, sendo o último registro de 2012. Sua extensão de ocorrência no país foi calculada em 2.122 km². Essa região já sofreu grande perda de vegetação nativa e os fragmentos encontram-se isolados por extensas áreas com atividades agrícolas, especialmente plantações de soja, que provocam declínio contínuo da qualidade do hábitat em decorrência do intenso uso do solo. Os fragmentos são pequenos e isolados e a população da espécie, que possui baixa capacidade de dispersão, encontra-se severamente fragmentada. Por essas razões, Apostolepis quirogai foi categorizada como Em Perigo (EN), pelo critério B1ab(iii).","Não","Sim","Rio Grande do Sul","|Sul|","Mata Atlântica","Sub-bacia Uruguai Médio","","","","","Desconhecida","2 - Agropecuária e Aquacultura|2.1 - Culturas anuais e perenes não-madeireiras|2.1.3 - Agricultura agro-industrial","","Plano de Ação Nacional (PAN)","Plano de Ação Nacional para a Conservação da Herpetofauna do Sul - 2º ciclo, Plano de Ação Nacional para a Conservação de Répteis e Anfíbios Ameaçados da Região Sul do Brasil","Lista Nacional Oficial de Espécies da Fauna Ameaçadas de Extinção 2014, Lista Nacional Oficial de Espécies da Fauna Ameaçadas de Extinção 2022","",""
"Animalia","Chordata","Reptilia","Squamata","Dipsadidae","Apostolepis","Apostolepis striata","","","Lema, 2004","cobra-rainha-estriada","Répteis","04/2012","Em Perigo","","B1ab(iii)","Apostolepis striata é endêmica do Brasil, conhecida apenas da localidade-tipo, em Vilhena, Rondônia, no lado leste da Chapada dos Parecis, na divisa com o estado de Mato Grosso, região de transição de errado com floresta amazônica (Cerradões), a 600 m de altitude. Suspeita-se que sua extensão de ocorrência seja menor que 5.000 km2. A área do registro foi considerada uma localização, cuja principal ameaça à espécie é a perda de habitat em decorrência do avanço recente da fronteira agropecuária, causando também o declínio contínuo da qualidade do habitat. Por essas razões, Apostolepis striata foi categorizada como Em Perigo (EN), pelo critério B1ab(iii).","Sim","Não","","||","","","","","","","Desconhecida","2 - Agropecuária e Aquacultura|2.1 - Culturas anuais e perenes não-madeireiras 2 - Agropecuária e Aquacultura|2.3 - Pecuária","","","","","",""
"Animalia","Arthropoda","Insecta","Lepidoptera","Nymphalidae","Actinote","Actinote quadra","","","(Schaus, 1902)","Borboleta-palha","Invertebrados Terrestres","11/2010","Vulnerável","","B2ab(ii,iii)","Apesar de amplamente distribuída em áreas de altitude na Mata Atlântica, sua área de ocupação (AOO) é menor do que 2.000 km2 e as populações são muito restritas, ocorrendo em 16 localidades.A maioria está fora de unidades de conservação, em áreas sujeitas à perda e degradação de habitat. As populações conhecidas são bastante desconectadas entre si. Com base nos dados disponíveis a espéciefoi categorizada como Vulnerável (VU), segundo o critério B2ab(ii,iii).","Sim","Não","Espírito Santo, Minas Gerais, Rio de Janeiro","|Sudeste|","Mata Atlântica","Sub-bacia Grande Sub-bacia Litoral ES Sub-bacia Litoral RJ Sub-bacia São Francisco Alto","APA Petrópolis, APA Serra da Mantiqueira, PARNA da Serra dos Órgãos, PARNA de Itatiaia, PARNA do Caparaó","ÁREA DE PROTEÇÃO AMBIENTAL SUL-RMBH, PARQUE ESTADUAL SERRA DO ROLA MOÇA","","Desconhecido","Desconhecida","1 - Desenvolvimento residencial e comercial 2 - Agropecuária e Aquacultura","","Proteção de recursos/habitat","","","",""
"Animalia","Arthropoda","Insecta","Lepidoptera","Nymphalidae","Actinote","Actinote zikani","","Actinote zikani","D´Almeida, 1951","Borboleta","Invertebrados Terrestres","09/2016","Criticamente em Perigo","Não","B1ab(i,ii,iii,v)c(iv)","Actinote zikani é endêmica do Brasil, registrada em uma única localidade, ao longo de uma trilha de 1,5km, no distrito de Paranapiacaba (município de Santo André) (SP). Sua Extensão de Ocorrência (EOO) e sua Área de Ocupação (AOO) foram calculadas em 12km2. Duas das três subpopulações originais da localidade tipo (Boracéia e Alto da Serra, SP), não foram localizadas desde o início da década de 90, mesmo com esforço de amostragem, o que caracteriza declínio da extensão de ocorrência, da área de ocupação e do número de indivíduos maduros de sua população. A porção restante da população conhecida está muito próxima de áreas de extrema pressão antrópica (vila de Paranapiacaba, município de Santo André), quase emendada com a região metropolitana de São Paulo e adjacente ao parque industrial de Cubatão, que adicionalmente promovem declínio da qualidade do habitat remanescente oriundas, sobretudo, da expansão urbana e poluição doméstica e industrial. Estudo populacional revelou flutuações extremas entre 1994 e 2006. Por essas razões, Actinote zikani foi categoriza como Criticamente em Perigo (CR), segundo os critérios B1ab(i,ii,iii,v)c(iv).","Sim","Sim","São Paulo","|Sudeste|","Mata Atlântica","Sub-bacia Litoral SP","","PARQUE ESTADUAL DA SERRA DO MAR","","Não","Declinando","1 - Desenvolvimento residencial e comercial|1.1 - Expansão urbana 1 - Desenvolvimento residencial e comercial|1.2 - Áreas comerciais e industriais 9 - Poluição|9.5 - Poluição do ar|9.5.1 - Chuva ácida 9 - Poluição|9.5 - Poluição do ar|9.5.2 - Fumaça (industrial veículos etc)","","Plano de Ação Nacional (PAN)","Plano de Ação Nacional para a Conservação de Insetos Polinizadores, Plano de Ação Nacional para a Conservação de Lepidópteros","Lista Nacional Oficial de Espécies da Fauna Ameaçadas de Extinção 2014, Lista Nacional Oficial de Espécies da Fauna Ameaçadas de Extinção 2022","",""
"Animalia","Chordata","Actinopterygii","Siluriformes","Pimelodidae","Aguarunichthys","Aguarunichthys tocantinsensis","","","Zuanon, Rapp Py-Daniel & Jégu, 1993","","Peixes Continentais","09/2013","Em Perigo","","A4c","Aguarunichthys tocantinsensis é endêmica do Brasil e ocorre na bacia dos rios Tocantins-Araguaia, nos estados de Goiás, Mato Grosso, Pará e Tocantins, onde é pouco frequente e pouco abundante. A Área de Ocupação estimada para Aguarunichthys tocantinsensis é de 6.140 km2. A perda e a fragmentação de habitat representam as principais ameaças a esta espécie, que é encontrada em áreas de correnteza forte e fundo pedregoso, locais que têm sido fortemente impactados pela construção de usinas hidrelétricas (UHEs). A perda de área, representada pela soma das áreas afetadas pelos reservatórios hidrelétricos de Tucuruí, Marabá, Serra Quebrada, Estreito, Tupiratins, Lajeado, Peixe-Angical, São Salvador, Cana Brava, Serra da Mesa e Santa Isabel nos rios Tocantins e Araguaia, foi estimada em 3.815 km2, que representa mais de 60% da Área de Ocupação da espécie. Considerando um prazo de três tempos geracionais equivalente a 27 anos, tanto os impactos já ocorridos quanto os previstos ou projetados para a bacia permitem estimar uma redução populacional de mais de 50%. Por esses motivos, Aguarunichthys tocantinsensis foi categorizada como Em Perigo (EN), pelos critérios A4c.","Sim","Não","Pará","|Norte|","Amazônia","Bacia do rio Tocantins Sub-bacia Tocantins Baixo","","","","","Declinando","3 - Produção energética e mineração|3.3 - Energia renovável|3.3.1 - Hidrelétricas 7 - Modificações nos sistemas naturais","","Proteção de locais/áreas","","","",""
"Animalia","Chordata","Aves","Passeriformes","Motacillidae","Anthus","Anthus nattereri","","Anthus nattereri","Sclater, 1878","caminheiro-grande","Aves","10/2021","Vulnerável","","A4c","Anthus nattereri ocorre no Paraguai, Argentina, Uruguai e nas regiões Sudeste e Sul do Brasil, nos estados de Minas Gerais, Paraná, Santa Catarina e Rio Grande do Sul. No estado de São Paulo a espécie foi extinta pela perda do seu habitat natural. A espécie é exigente quanto ao habitat e sofre declínio populacional devido à perda dos campos naturais dos quais depende. Essas áreas vêm sendo ocupadas por monoculturas de soja, Pinus spp. e eucalipto em praticamente toda sua área de distribuição. A projeção da perda de habitat, baseada nos dados de sensoriamento remoto (passado) e em um modelo de suavização exponencial (futuro), indicam perda de 30% da vegetação em 10 anos (três gerações), quando consideradas perdas no passado e futuro (2015-2025). A avaliação não é alterada quando se verifica a inﬂuência da população oriunda de outros países. Dessa forma, A. nattereri foi categorizada como Vulnerável (VU), pelo critério A4c.","Não","Sim","Minas Gerais, Paraná, Rio Grande do Sul, Santa Catarina","|Sudeste|Sul|","Cerrado, Mata Atlântica, Pampa","Sub-bacia Grande Sub-bacia Guaíba Sub-bacia Ibicuí Sub-bacia Iguaçu Sub-bacia Litoral RJ SP Sub-bacia Litoral RS Sub-bacia Litoral SP PR SC Sub-bacia Paranaíba Sub-bacia Paranapanema Sub-bacia São Francisco Alto Sub-bacia Uruguai Alto","Parna Aparados da Serra, PARNA da Lagoa do Peixe, PARNA da Serra da Canastra, PARNA da Serra Geral, REVIS dos Campos de Palmas","ÁREA DE PROTEÇÃO AMBIENTAL DO RIO VERDE, ÁREA DE PROTEÇÃO AMBIENTAL ESTADUAL DA ESCARPA DEVONIANA, ÁREA DE PROTEÇÃO AMBIENTAL SERRA SÃO JOSÉ, ESTAçãO ECOLóGICA DE SANTA BáRBARA, PARQUE ESTADUAL DO TAINHAS, REFÚGIO ESTADUAL DE VIDA SILVESTRE LIBÉLULAS DA SERRA DE SÃO JOSÉ","RPPN Cachoeira do Cerradão, RPPN das Araucárias, RPPN Fazenda Primavera, RPPN Gralha-Azul, RPPN Rancho Mira-Serra","Não","Declinando","2 - Agropecuária e Aquacultura|2.1 - Culturas anuais e perenes não-madeireiras|2.1.3 - Agricultura agro-industrial 2 - Agropecuária e Aquacultura|2.2 - Silvicultura|2.2.3 - Plantações em escala desconhecida 2 - Agropecuária e Aquacultura|2.3 - Pecuária|2.3.4 - Pecuária em escala desconhecida 6 - Distúrbios humanos|6.1 - Atividades recreacionais/turísticas 7 - Modificações nos sistemas naturais|7.1 - Incêndios e supressão de incêndios|7.1.1 - Aumento da frequência/intensidade de incêndios 8 - Espécies invasoras problemáticas e doenças|8.2 - Espécies domésticas|8.2.1 - Competidores 9 - Poluição|9.3 - Agropecuária e florestal|9.3.3 - Herbicidas e pesticidas","","Controle de espécies invasoras/problemáticas, Criação de áreas protegidas, Plano de Ação Nacional (PAN)","Plano de Ação Nacional para a Conservação das Aves dos Campos Sulinos - 2º ciclo, Plano de Ação Nacional para a Conservação dos Passeriformes Ameaçados dos Campos Sulinos e Espinilho","Lista Nacional Oficial de Espécies da Fauna Ameaçadas de Extinção 2014, Lista Nacional Oficial de Espécies da Fauna Ameaçadas de Extinção 2022","",""
"Animalia","Chordata","Mammalia","Primates","Atelidae","Alouatta","Alouatta belzebul","","Alouatta belzebul","(Linnaeus, 1766)","Bugio, Guariba, Guariba-de-mãos-ruivas, Guariba-de-mãos-vermelhas","Mamíferos","09/2019","Vulnerável","","A2cd","Alouatta belzebul é endêmica do Brasil, apresentando distribuição disjunta, parte na Amazônia (Amapá, Maranhão, Mato Grosso, Pará e Tocantins), parte na Mata Atlântica nordestina (Alagoas, Paraíba, Pernambuco e Rio Grande do Norte). Na Mata Atlântica, infere-se que nos últimos 36 anos (três gerações) houve uma redução populacional de, pelo menos, 30% em razão da caça e da perda, degradação e fragmentação de hábitat. Suspeita-se de uma redução populacional de mesma proporção na Amazônia, para o período entre 1985 e 2020 (tempo aproximado de três gerações) em decorrência de estimativas da perda e degradação de hábitat e da caça. A subpopulação da Mata Atlântica encontra-se em maior risco de extinção do que a da Amazônia, em virtude da área de ocupação conhecida ser inferior a 500 km² e o número de indivíduos maduros estimado estar entre 250 e 500. Entretanto, considerando que mais de 90% da população é amazônica, Alouatta belzebul foi categorizada como Vulnerável (VU) pelo critério A2cd.","Sim","Sim","Alagoas, Amapá, Maranhão, Mato Grosso, Pará, Paraíba, Pernambuco, Rio Grande do Norte, Tocantins","|Centro-Oeste|Nordeste|Norte|","Amazônia, Cerrado, Mata Atlântica","Sub-bacia Araguaia Sub-bacia Foz Amazonas Sub-bacia Gurupi Sub-bacia Itapecuru Sub-bacia Litoral AL PE PB Sub-bacia Litoral CE PB Sub-bacia Mearim Sub-bacia Paraíba Sub-bacia Tocantins Alto Sub-bacia Tocantins Baixo Sub-bacia Xingu","APA Igarapé Gelado, ESEC de Murici, FLONA Carajás, FLONA Caxiuanã, FLONA Tapirape-Aquiri, PARNA Araguaia, REBIO do Gurupi, REBIO Guaribas, REBIO Tapirapé, RESEX Maracanã, RESEX Quilombo Flexal","ÁREA DE PROTEçãO AMBIENTAL DAS REENTRâNCIAS MARANHENSES, ÁREA DE PROTEÇÃO AMBIENTAL DE MURICÍ, ÁREA DE PROTEçãO AMBIENTAL DE UPAON-AçU / MIRITIBA / ALTO PREGUIçAS, ÁREA DE PROTEÇÃO AMBIENTAL DO ARQUIPÉLAGO DO MARAJÓ, ÁREA DE PROTEÇÃO AMBIENTAL DO LAGO DE TUCURUI, ÁREA DE PROTEÇÃO AMBIENTAL DO RIO CURIAÚ, RESERVA DE DESENVOLVIMENTO SUSTENTÁVEL ALCOBAÇA, RESERVA DE DESENVOLVIMENTO SUSTENTÁVEL PUCURUÍ - ARARÃO","RPPN Mata Estrela","Não","Declinando","11 - Mudanças e extremos climáticos|11.1 - Mudança/alteração de habitat 1 - Desenvolvimento residencial e comercial|1.1 - Expansão urbana 1 - Desenvolvimento residencial e comercial|1.4 - Assentamentos e pequenas propriedades rurais 2 - Agropecuária e Aquacultura|2.1 - Culturas anuais e perenes não-madeireiras|2.1.3 - Agricultura agro-industrial 2 - Agropecuária e Aquacultura|2.2 - Silvicultura|2.2.2 - Plantações agro-industriais 2 - Agropecuária e Aquacultura|2.3 - Pecuária|2.3.3 - Pecuária agro-industrial 3 - Produção energética e mineração|3.3 - Energia renovável|3.3.1 - Hidrelétricas 4 - Transportes e serviços de transmissão|4.1 - Estradas e ferrovias 4 - Transportes e serviços de transmissão|4.2 - Atropelamentos 4 - Transportes e serviços de transmissão|4.7 - Linhas de força/transmissão 5 - Uso de recursos biológicos|5.1 - Caça e captura de animais terrestres ou marinhos|5.1.1 - Caça/captura intencional (a espécie é o alvo) 5 - Uso de recursos biológicos|5.3 - Extração florestal|5.3.1 - Uso intencional - subsistência/pequena escala 5 - Uso de recursos biológicos|5.3 - Extração florestal|5.3.2 - Uso intencional - larga escala 7 - Modificações nos sistemas naturais|7.1 - Incêndios e supressão de incêndios|7.1.1 - Aumento da frequência/intensidade de incêndios","1 - Alimentação humana|1.1 - Caça de subsistência 3 - Animais de estimação/ornamentais","Plano de Ação Nacional (PAN)","Plano de Ação Nacional para a Conservação dos Primatas Amazônicos, Plano de Ação Nacional para a Conservação dos Primatas do Nordeste, Plano de Ação Nacional para a Conservação dos Primatas do Nordeste - 2º ciclo","CITES - Anexo II, Lista Nacional Oficial de Espécies da Fauna Ameaçadas de Extinção 2014, Lista Nacional Oficial de Espécies da Fauna Ameaçadas de Extinção 2022","",""
"Animalia","Chordata","Mammalia","Primates","Atelidae","Alouatta","Alouatta discolor","","Alouatta discolor","(Spix, 1823)","Guariba-de-mãos-ruivas, guariba-de-mãos-vermelhas","Mamíferos","09/2019","Vulnerável","","A4cd","Alouatta discolor é endêmica do Brasil, presente nos estados do Pará e Mato Grosso, na região do arco do desmatamento. Suspeita-se de um declínio populacional de pelo menos 30% ao longo de 36 anos (três gerações), com base em uma estimativa de perda de habitat de 22% entre 2005 e 2040 fora de Áreas Protegidas, além de degradação ambiental e fragmentação potencializados pelo recente asfaltamento das rodovias BR-163 e BR-230, implantação de hidrelétricas, pecuária extensiva e abertura de lavouras mecanizadas (principalmente soja). Além disso, a espécie é intensamente caçada. Portanto, Alouatta discolor foi categorizada como Vulnerável (VU) pelo critério A4cd.","Sim","Sim","Mato Grosso, Pará","|Centro-Oeste|Norte|","Amazônia","Sub-bacia Paru Sub-bacia Tapajós Sub-bacia Xingu","APA Tapajós, ESEC da Terra do Meio, FLONA Altamira, FLONA do Tapajós, FLONA Itaituba I, FLONA Itaituba II, FLONA Jamanxim, FLONA Trairão, PARNA do Jamanxim, PARNA Rio Novo, REBIO Nascentes da Serra do Cachimbo, RESEX Rio Iriri, RESEX Riozinho do Anfrísio","","","Não","Declinando","1 - Desenvolvimento residencial e comercial|1.4 - Assentamentos e pequenas propriedades rurais 2 - Agropecuária e Aquacultura|2.1 - Culturas anuais e perenes não-madeireiras|2.1.3 - Agricultura agro-industrial 2 - Agropecuária e Aquacultura|2.3 - Pecuária|2.3.3 - Pecuária agro-industrial 3 - Produção energética e mineração|3.2 - Mineração|3.2.4 - Extração de minérios - garimpo 3 - Produção energética e mineração|3.3 - Energia renovável|3.3.1 - Hidrelétricas 4 - Transportes e serviços de transmissão|4.1 - Estradas e ferrovias 5 - Uso de recursos biológicos|5.1 - Caça e captura de animais terrestres ou marinhos|5.1.1 - Caça/captura intencional (a espécie é o alvo)","","Plano de Ação Nacional (PAN)","Plano de Ação Nacional para a Conservação dos Primatas Amazônicos","Lista Nacional Oficial de Espécies da Fauna Ameaçadas de Extinção 2014, Lista Nacional Oficial de Espécies da Fauna Ameaçadas de Extinção 2022","",""
"Animalia","Chordata","Mammalia","Primates","Atelidae","Alouatta","Alouatta ululata","","Alouatta ululata","Elliot, 1912","Capelão, Guariba, Guariba-da-Caatinga","Mamíferos","09/2019","Em Perigo","","C2a(i)","Alouatta ululata é uma espécie endêmica do Brasil, ocorrendo nos estados do Maranhão, Piauí e Ceará, em áreas na Caatinga e no Cerrado, além de manguezais. Infere-se que há um declínio populacional continuado, causado, principalmente, pela perda, degradação e fragmentação de habitat em função da agricultura, pecuária, mineração, carvoaria e retirada de indivíduos da natureza em virtude de caça. Estima-se que o número de grupos existentes seja menor que 1.000, sendo assim, infere-se que o número de indivíduos maduros esteja próximo de 2.500, distribuídos em subpopulações com menos de 250 indivíduos maduros. Deste modo, Alouatta ululata foi categorizada como Em Perigo (EN) pelo critério C2a(i).","Sim","Sim","Ceará, Maranhão, Piauí","|Nordeste|","Caatinga, Cerrado","Sub-bacia Itapecuru Sub-bacia Jaguaribe Sub-bacia Litoral CE PI Sub-bacia Parnaíba Alto Sub-bacia Parnaíba Baixo Sub-bacia Parnaíba Médio","APA Delta do Parnaíba, APA Serra da Ibiapaba, PARNA de Ubajara, PARNA Lençóis Maranhenses, RESEX Marinha do Delta do Parnaíba","ÁREA DE PROTEçãO AMBIENTAL DA FOZ DO RIO DAS PREGUIçAS - PEQUENOS LENçóIS - REGIãO LAGUNAR ADJACENTE, ÁREA DE PROTEçãO AMBIENTAL DE UPAON-AçU / MIRITIBA / ALTO PREGUIçAS","RPPN Serra das Almas II","Não","Declinando","11 - Mudanças e extremos climáticos|11.2 - Secas 1 - Desenvolvimento residencial e comercial|1.1 - Expansão urbana 1 - Desenvolvimento residencial e comercial|1.4 - Assentamentos e pequenas propriedades rurais 2 - Agropecuária e Aquacultura|2.1 - Culturas anuais e perenes não-madeireiras|2.1.3 - Agricultura agro-industrial 2 - Agropecuária e Aquacultura|2.3 - Pecuária|2.3.3 - Pecuária agro-industrial 3 - Produção energética e mineração|3.2 - Mineração|3.2.3 - Extração de minérios - subsolo 3 - Produção energética e mineração|3.3 - Energia renovável|3.3.1 - Hidrelétricas 5 - Uso de recursos biológicos|5.1 - Caça e captura de animais terrestres ou marinhos|5.1.1 - Caça/captura intencional (a espécie é o alvo) 8 - Espécies invasoras problemáticas e doenças|8.4 - Espécies problemáticas de origem desconhecida|8.4.2 - Espécie não conhecida|8.4.2.1 - Competidores","1 - Alimentação humana|1.1 - Caça de subsistência 2 - Alimentação animal 3 - Animais de estimação/ornamentais 5 - Medicina humana ou veterinária","Plano de Ação Nacional (PAN)","Plano de Ação Nacional para a Conservação dos Primatas do Nordeste, Plano de Ação Nacional para a Conservação dos Primatas do Nordeste - 2º ciclo, Plano de Ação Nacional para Conservação de Espécies Ameaçadas e de Importância Socioeconômica do Ecossistema Manguezal","Lista Nacional Oficial de Espécies da Fauna Ameaçadas de Extinção 2014, Lista Nacional Oficial de Espécies da Fauna Ameaçadas de Extinção 2022","",""
"Animalia","Arthropoda","Insecta","Zygoptera","Coenagrionidae","Aceratobasis","Aceratobasis cornicauda","","","(Calvert, 1909)","Libélula","Invertebrados de Água Doce","05/2014","Vulnerável","","B2ab(i,ii,iii)","Aceratobasis cornicauda é endêmica do Brasil, ocorrendo em quinze localidades nos estados do Espírito Santo e Bahia. Sua extensão de ocorrência foi estimada em 11.000 km2. Essa espécie parece estar associada a ambientes florestais, o que permite estabelecer que a perda desse ambiente dentro de sua extensão de ocorrência tem efeito direto sobre sua manutenção na paisagem. Assim sua área de ocupação, considerando apenas a presença de remanescentes florestais dentro da extensão de ocorrência, foi estimada em 1.800 km2. Sua área de ocupação encontra-se fragmentada pelo intenso processo de conversão para agricultura, plantios de Eucalipto e ambientes urbanizados onde a espécie não é capaz de persistir. As alterações nessa paisagem levam a uma severa perda de extensão e qualidade de habitat, representado uma ameaça direta sobre a população. A região de sua distribuição foi recentemente foco de estudos com intenso esforço amostral que resultaram na identificação apenas de poucas novas subpopulações o que pode indicar sua sensibilidade ao processo de fragmentação e perda de habitat na região. Considerando essa situação, Aceratobasis cornicauda foi categorizada como Vulnerável (VU) pelo critério B2ab(i,ii,iii).","Sim","Não","Espírito Santo","|Sudeste|","Mata Atlântica","Sub-bacia Litoral BA ES Sub-bacia Litoral ES","FLONA do Rio Preto, REBIO do Córrego Grande","","","Não","Desconhecida","1 - Desenvolvimento residencial e comercial|1.1 - Expansão urbana 2 - Agropecuária e Aquacultura 2 - Agropecuária e Aquacultura|2.2 - Silvicultura","","","","","",""
"Animalia","Arthropoda","Insecta","Zygoptera","Coenagrionidae","Aceratobasis","Aceratobasis mourei","","","(Santos, 1970)","Libélula","Invertebrados de Água Doce","05/2014","Em Perigo","","B2ab(i,ii,iii)","Aceratobasis mourei é endêmica do Brasil ocorrendo em cinco localidades em dois municípios no Espírito Santo e com extensão de ocorrência (EOO) estimada em 1.950 km2. Essa espécie parece estar associada a ambientes florestais, o que permite estabelecer que a perda desse ambiente dentro de sua extensão de ocorrência tem efeito direto sobre sua manutenção na paisagem. Assim sua área de ocupação (AOO), considerando apenas a presença de remanescentes florestais dentro da extensão de ocorrência, foi estimada em 220 km2. Sua AOO encontra-se fragmentada pelo intenso processo de conversão para agricultura, plantios de Eucalipto e ambientes urbanizados onde a espécie não é capaz de persistir. As alterações nessa paisagem levam a uma severa perda de extensão e qualidade de habitat, representado uma ameaça direta sobre a população. A região de sua distribuição foi recentemente foco de estudos com intenso esforço amostral que resultaram na identificação apenas de poucas novas sub-populações o que pode indicar sua sensibilidade ao processo de fragmentação e perda de habitat na região. Considerando essa situação, Aceratobasis mourei foi categorizada como Em Perigo (EN), pelo critério B2ab(i,ii,iii).","Sim","Não","Espírito Santo","|Sudeste|","Mata Atlântica","Sub-bacia Litoral BA ES","REBIO do Córrego Grande","","","Desconhecido","Desconhecida","1 - Desenvolvimento residencial e comercial|1.1 - Expansão urbana 2 - Agropecuária e Aquacultura 2 - Agropecuária e Aquacultura|2.2 - Silvicultura","","","","","",""
